{
  "event_id": "55555555-5555-4555-8555-555555555555",
  "schema_version": 1,
  "event_type": "repo.source.acquired",
  "occurred_at": "2026-09-16T12:00:00Z",
  "aggregate_id": "22222222-2222-4222-8222-222222222222",
  "trace_id": "66666666-6666-4666-8666-666666666666",
  "payload": {
    "job_id": "22222222-2222-4222-8222-222222222222",
    "repository_id": "11111111-1111-4111-8111-111111111111",
    "generation_id": "44444444-4444-4444-8444-444444444444",
    "principal_id": "77777777-7777-4777-8777-777777777777",
    "commit_sha": "0123456789abcdef0123456789abcdef01234567",
    "manifest_digest": "aaaaaaaaaaaaaaaaaaaaaaaaaaaaaaaaaaaaaaaaaaaaaaaaaaaaaaaaaaaaaaaa",
    "policy_version": "source-v1"
  }
}
